{"$schema":"https://json-schema.org/draft/2020-12/schema","title":"MPE Scenario","type":"object","required":["name","scenario_version","master_seed","populations"],"properties":{"name":{"type":"string"},"scenario_version":{"type":"integer","minimum":1},"simulation_version":{"type":"string"},"master_seed":{"type":"integer","minimum":0},"ticks":{"type":"integer","minimum":0},"populations":{"type":"array","minItems":1,"items":{"type":"object","required":["archetype","count"],"properties":{"archetype":{"type":"string"},"count":{"type":"integer","minimum":0}}}},"rules":{"type":"array","items":{"type":"string"}},"presentation":{"type":"object"}}}