{"name":"ant_colony","scenario_version":1,"simulation_version":"0.1.0","master_seed":9001,"ticks":120,"populations":[{"archetype":"ant","count":12},{"archetype":"robot","count":2}],"rules":["foraging","cooperation","territory"],"presentation":{"camera":"colony","layers":["agents","colonies","resources"]}}